{
  "formatName": "A test PRONOM file",
  "formatDescription": "This is a test file",
  "internalSignatures": [
    {
      "positionType": "Absolute from BOF",
      "offset": 0,
      "maxOffset": 0,
      "byteSequence": "5445535450524F4E4F4D",
      "name": "PRONOM test",
      "note": "A PRONOM test signature",
      "signatureID": 3371
    }
  ],
  "fileFormatID": 3882,
  "identifiers": [
    {
      "identifierType": "PUID",
      "identifierText": "fmt/2010"
    }
  ]
}